{
  "schemaVersion": 1,
  "ruleVersion": "1.0.0",
  "placeholders": [
    "[REDACTED]",
    "[USER]",
    "[EMAIL REDACTED]",
    "[PRIVATE IP REDACTED]",
    "[PRIVATE KEY REDACTED]"
  ],
  "precedence": ["SR-008", "SR-007", "SR-002", "SR-009", "SR-001", "SR-003", "SR-004", "SR-005", "SR-006"],
  "rules": [
    {
      "id": "SR-001",
      "name": "Named secret values",
      "detector": "named-value",
      "defaultEnabled": true,
      "optional": false,
      "placeholder": "[REDACTED]",
      "description": "Redacts the value assigned to a key whose final segment names a secret, such as password=, DB_PASSWORD=, \"clientSecret\": or --password. Keys are split into segments at _, -, . and camel-case transitions.",
      "examples": [
        ["password=fake-value", "password=[REDACTED]"],
        ["export GITHUB_TOKEN=fake", "export GITHUB_TOKEN=[REDACTED]"],
        ["\"clientSecret\": \"fake\"", "\"clientSecret\": \"[REDACTED]\""],
        ["--password fake --verbose", "--password [REDACTED] --verbose"]
      ],
      "nonExamples": ["password_length=16", "token_type=Bearer", "max_tokens=10", "password=null"],
      "limitations": [
        "Unquoted values end at whitespace, , ; & quotes and brackets, so an unquoted password containing those characters is only partly redacted; quoted values are fully handled.",
        "Multi-line strings, arrays, and objects are not treated as assigned values."
      ],
      "data": {
        "singleAliases": [
          "password", "passwd", "pwd", "passphrase", "secret", "token", "apikey",
          "accountkey", "sharedaccesskey", "sig", "credential", "credentials"
        ],
        "pairAliases": [
          ["api", "key"], ["access", "token"], ["refresh", "token"], ["id", "token"],
          ["auth", "token"], ["session", "token"], ["bearer", "token"], ["client", "secret"],
          ["private", "key"], ["secret", "key"], ["access", "key"], ["signing", "key"],
          ["encryption", "key"], ["master", "key"], ["account", "key"]
        ],
        "skipValues": ["null", "nil", "none", "None", "true", "false", "True", "False", "undefined"]
      }
    },
    {
      "id": "SR-002",
      "name": "Authorization credentials",
      "detector": "authorization",
      "defaultEnabled": true,
      "optional": false,
      "placeholder": "[REDACTED]",
      "description": "Redacts the credential in Authorization and Proxy-Authorization fields while keeping a recognized scheme name. Parameterized schemes such as Digest are redacted to the end of the field; when the first word is not a recognized scheme, the whole field is redacted.",
      "examples": [
        ["Authorization: Bearer fake-token", "Authorization: Bearer [REDACTED]"],
        ["\"authorization\": \"Basic ZmFrZTpmYWtl\"", "\"authorization\": \"Basic [REDACTED]\""]
      ],
      "nonExamples": ["Authorization: [REDACTED]"],
      "limitations": [
        "Credentials are never decoded; header names other than the two listed are not covered.",
        "An unrecognized scheme name is redacted together with its credential."
      ],
      "data": {
        "headers": ["authorization", "proxy-authorization"],
        "schemes": [
          "basic", "bearer", "digest", "negotiate", "ntlm", "token", "bot", "apikey", "api-key",
          "hoba", "mutual", "scram-sha-1", "scram-sha-256", "vapid", "aws4-hmac-sha256", "dpop",
          "gnap", "privatetoken", "oauth", "signature", "hmac", "key", "ssws"
        ]
      }
    },
    {
      "id": "SR-003",
      "name": "URL credentials",
      "detector": "url-credential",
      "defaultEnabled": true,
      "optional": false,
      "placeholder": "[REDACTED]",
      "description": "Redacts the password in scheme://user:password@host for any scheme, keeping scheme, user, host, port, path, query, and fragment.",
      "examples": [
        ["postgresql://app:fake-pass@db/app", "postgresql://app:[REDACTED]@db/app"],
        ["jdbc:mysql://root:fake@10.0.0.5:3306/x", "jdbc:mysql://root:[REDACTED]@10.0.0.5:3306/x"]
      ],
      "nonExamples": ["https://user@host/path", "https://host:8443/path"],
      "limitations": ["User information without a password separator is not covered; reserved delimiters inside passwords must be percent-encoded."],
      "data": {}
    },
    {
      "id": "SR-004",
      "name": "Home-directory usernames",
      "detector": "home-path",
      "defaultEnabled": true,
      "optional": false,
      "placeholder": "[USER]",
      "description": "Redacts the username segment of /home/<user>, /Users/<user>, and C:\\Users\\<user> paths, including JSON-escaped Windows separators, keeping the rest of the path.",
      "examples": [
        ["/home/alex/app/config.yml", "/home/[USER]/app/config.yml"],
        ["C:\\Users\\alex\\app.log", "C:\\Users\\[USER]\\app.log"],
        ["HOME=/home/alex", "HOME=/home/[USER]"]
      ],
      "nonExamples": ["see https://example.com/home/about/", "/home/1001/"],
      "limitations": ["UNC paths, ~user, C:\\Documents and Settings\\, and personal names elsewhere in text are not covered."],
      "data": {
        "posixPrefixes": ["/home/", "/Users/"],
        "windowsDirectory": "users"
      }
    },
    {
      "id": "SR-005",
      "name": "Email addresses",
      "detector": "email",
      "defaultEnabled": true,
      "optional": true,
      "placeholder": "[EMAIL REDACTED]",
      "description": "Redacts email-shaped strings using a pragmatic ASCII grammar. Inside a URL authority, only the username part can match.",
      "examples": [["user=alex@example.com", "user=[EMAIL REDACTED]"]],
      "nonExamples": ["alex@localhost", "postgresql://app:pw@db.example/app"],
      "limitations": ["Quoted local parts, internationalized addresses, address literals, and single-label domains are not covered."],
      "data": {}
    },
    {
      "id": "SR-006",
      "name": "Private IP addresses",
      "detector": "private-ip",
      "defaultEnabled": false,
      "optional": true,
      "placeholder": "[PRIVATE IP REDACTED]",
      "description": "Redacts RFC 1918 IPv4 addresses and IPv6 unique-local addresses, keeping ports, CIDR suffixes, zone identifiers, and URL brackets.",
      "examples": [
        ["host=10.0.0.8:5432", "host=[PRIVATE IP REDACTED]:5432"],
        ["addr=[fd12:3456::1]:443", "addr=[[PRIVATE IP REDACTED]]:443"]
      ],
      "nonExamples": ["host=172.32.0.1", "110.0.0.1", "10.0.0.256"],
      "limitations": ["Public, loopback, link-local, shared-address-space, and integer or hexadecimal IP encodings are not covered."],
      "data": {
        "ipv4": ["10.0.0.0/8", "172.16.0.0/12", "192.168.0.0/16"],
        "ipv6": ["fc00::/7"]
      }
    },
    {
      "id": "SR-007",
      "name": "Known credential formats",
      "detector": "token-format",
      "defaultEnabled": true,
      "optional": false,
      "placeholder": "[REDACTED]",
      "description": "Redacts tokens with a documented, prefix-identifiable format wherever they appear. A run longer than the minimum is redacted whole.",
      "examples": [["key AKIAFAKEFAKEFAKE0000", "key [REDACTED]"]],
      "nonExamples": ["AKIA-not-a-key", "ghp_short"],
      "limitations": ["Only the formats listed are recognized; high-entropy strings without a known prefix need a named key."],
      "data": {
        "formats": [
          {
            "id": "aws-access-key-id",
            "provider": "AWS access key ID",
            "prefixes": ["AKIA", "ASIA"],
            "segments": [{ "charset": "alnum-upper", "min": 16, "exact": true }],
            "source": "https://docs.aws.amazon.com/IAM/latest/UserGuide/reference_identifiers.html"
          },
          {
            "id": "github-token",
            "provider": "GitHub OAuth, user, server, and refresh tokens and classic personal access tokens",
            "prefixes": ["ghp_", "gho_", "ghu_", "ghs_", "ghr_"],
            "segments": [{ "charset": "alnum", "min": 36 }],
            "source": "https://docs.github.com/en/authentication/keeping-your-account-and-data-secure/about-authentication-to-github#githubs-token-formats"
          },
          {
            "id": "github-fine-grained-pat",
            "provider": "GitHub fine-grained personal access token",
            "prefixes": ["github_pat_"],
            "segments": [{ "charset": "alnum-us", "min": 82 }],
            "source": "https://docs.github.com/en/authentication/keeping-your-account-and-data-secure/about-authentication-to-github#githubs-token-formats"
          },
          {
            "id": "gitlab-token",
            "provider": "GitLab personal, deploy, and runner tokens",
            "prefixes": ["glpat-", "gldt-", "glrt-"],
            "segments": [{ "charset": "b64url-dot", "min": 20 }],
            "source": "https://docs.gitlab.com/security/tokens/"
          },
          {
            "id": "slack-token",
            "provider": "Slack bot, user, and app tokens",
            "prefixes": ["xoxb-", "xoxp-", "xoxa-", "xoxr-", "xoxs-", "xapp-"],
            "segments": [{ "charset": "alnum-dash", "min": 10 }],
            "source": "https://docs.slack.dev/authentication/tokens/"
          },
          {
            "id": "stripe-key",
            "provider": "Stripe secret and restricted keys",
            "prefixes": ["sk_live_", "sk_test_", "rk_live_", "rk_test_"],
            "segments": [{ "charset": "alnum", "min": 16 }],
            "source": "https://docs.stripe.com/keys"
          },
          {
            "id": "stripe-webhook-secret",
            "provider": "Stripe webhook signing secret",
            "prefixes": ["whsec_"],
            "segments": [{ "charset": "alnum", "min": 24 }],
            "source": "https://docs.stripe.com/webhooks"
          },
          {
            "id": "google-api-key",
            "provider": "Google API key",
            "prefixes": ["AIza"],
            "segments": [{ "charset": "b64url", "min": 35, "exact": true }],